{
  "$schema": "https://json-schema.org/draft/2020-12/schema",
  "$id": "https://raw.githubusercontent.com/fuermosi777/rewards/main/schema/card.schema.json",
  "title": "Card",
  "description": "Low-churn card record: identity + ongoing (recurring) benefits. Sign-up bonuses live in a separate bonus.schema.json record keyed by the same cardId, because bonuses change far more often than benefit terms and would otherwise pollute this file's git history.",
  "type": "object",
  "required": ["id", "issuerId", "name", "network", "variant", "annualFee", "status", "benefits", "sourceMeta", "imageUrl"],
  "properties": {
    "id": {
      "type": "string",
      "pattern": "^[a-z0-9-]+$",
      "description": "Stable lowercase-dash id, e.g. 'chase-sapphire-preferred'. Matches the filename (without .json) and the cardId used in data/bonuses/."
    },
    "imageUrl": {
      "type": "string",
      "description": "Relative repository path to card cover image PNG, e.g. 'data/assets/cards/chase-sapphire-preferred.png'."
    },
    "issuerId": {
      "type": "string",
      "description": "References an id in data/issuers.json."
    },
    "name": {
      "type": "string",
      "description": "Official full card name as printed on the issuer's site."
    },
    "network": {
      "type": "string",
      "enum": ["Visa", "Mastercard", "Amex", "Discover"]
    },
    "variant": {
      "type": "string",
      "enum": ["personal", "business"]
    },
    "annualFee": {
      "type": "object",
      "required": ["amount", "currency"],
      "properties": {
        "amount": { "type": "number", "minimum": 0 },
        "currency": { "const": "USD" },
        "waivedFirstYear": { "type": "boolean" }
      },
      "additionalProperties": false
    },
    "foreignTransactionFee": {
      "type": "boolean"
    },
    "status": {
      "type": "string",
      "enum": ["active", "discontinued", "invite_only"],
      "description": "active = currently open to new applicants. discontinued = no longer offered, but existing cardholders may still carry it (keep the record, don't delete). invite_only = not publicly applyable."
    },
    "discontinuedDate": {
      "type": "string",
      "format": "date",
      "description": "Only set when status = discontinued. May be a future date: issuers sometimes announce a discontinuation/conversion ahead of the effective date (e.g. a co-brand card converting to a different issuer's product on a known future date). Set status = discontinued as soon as the discontinuation is announced/confirmed, with this date reflecting when it takes effect — don't wait until the date has passed."
    },
    "benefits": {
      "type": "array",
      "items": { "$ref": "#/$defs/benefit" }
    },
    "earningRates": {
      "type": "array",
      "description": "Permanent point/cashback multipliers by spend category — the card's base earning structure, applied automatically at purchase (no enrollment, no per-cycle reset, nothing for a user to redeem or track usage of). Kept separate from benefits[], which is reserved for things a user enrolls in, redeems, or tracks consumption of. This array is what powers 'which card should I use for this purchase' recommendations.",
      "items": { "$ref": "#/$defs/earningRate" }
    },
    "sourceMeta": { "$ref": "#/$defs/sourceMeta" },
    "_note": {
      "type": "string",
      "description": "Free-text flag for a transitional or uncertain situation an update agent should revisit (e.g. a discontinued card whose imageUrl is a stand-in because no authoritative card art is still published). Not machine-consumed; delete once the situation resolves and this card's fields reflect the settled state."
    },
    "_scaffoldHints": {
      "type": "object",
      "description": "Temporary, non-authoritative leads left by the scaffold generator (e.g. raw unstructured hints from a bootstrap data source) to help whoever fills in benefits[] next. Must be deleted once the card's benefits[] has been populated and verified — a card.json with this key present is signal that benefits[] is still scaffold/incomplete, not reviewed data."
    }
  },
  "additionalProperties": false,

  "$defs": {
    "benefit": {
      "type": "object",
      "description": "One recurring or one-time perk. benefitType selects which *Detail sub-object is required, so wildly different perks (a flat statement credit vs. a rotating 5% category vs. lounge access vs. a free night award) share one array and one tracking model in the app.",
      "required": ["id", "name", "benefitType", "category"],
      "properties": {
        "id": {
          "type": "string",
          "description": "Unique within this card, e.g. 'csp-annual-hotel-credit'."
        },
        "name": { "type": "string" },
        "description": { "type": "string" },
        "benefitType": {
          "type": "string",
          "enum": [
            "statement_credit",
            "bonus_category",
            "lounge_access",
            "elite_status",
            "free_night_award",
            "trusted_traveler_credit",
            "insurance",
            "membership",
            "companion_ticket",
            "points_multiplier",
            "other"
          ]
        },
        "category": {
          "type": "string",
          "enum": [
            "travel", "dining", "transportation", "entertainment",
            "shopping", "wellness", "airline", "hotel", "streaming",
            "wireless", "other"
          ]
        },
        "renewalPeriod": {
          "$ref": "shared/period.schema.json",
          "description": "Omit entirely when isOneTime is true."
        },
        "isOneTime": {
          "type": "boolean",
          "default": false,
          "description": "True for perks that don't recur (most one-time welcome perks live in bonus.schema.json instead; this is for the rare one-time perk tied to the core card record). When true, renewalPeriod must be omitted."
        },

        "statementCreditDetail": { "$ref": "#/$defs/statementCreditDetail" },
        "bonusCategoryDetail": { "$ref": "#/$defs/bonusCategoryDetail" },
        "loungeAccessDetail": { "$ref": "#/$defs/loungeAccessDetail" },
        "freeNightAwardDetail": { "$ref": "#/$defs/freeNightAwardDetail" },

        "terms": {
          "type": "string",
          "description": "Free-text key conditions, e.g. enrollment requirements, caps, exclusions."
        },
        "sourceUrl": { "type": "string", "format": "uri" },
        "lastVerified": {
          "type": "string",
          "format": "date",
          "description": "Date this specific benefit's terms were last confirmed against a source. Distinct from the card-level sourceMeta.lastReviewedDate."
        }
      },
      "additionalProperties": false,
      "allOf": [
        {
          "if": { "properties": { "benefitType": { "const": "statement_credit" } }, "required": ["benefitType"] },
          "then": { "required": ["statementCreditDetail"] }
        },
        {
          "if": { "properties": { "benefitType": { "const": "bonus_category" } }, "required": ["benefitType"] },
          "then": { "required": ["bonusCategoryDetail"] }
        },
        {
          "if": { "properties": { "benefitType": { "const": "lounge_access" } }, "required": ["benefitType"] },
          "then": { "required": ["loungeAccessDetail"] }
        },
        {
          "if": { "properties": { "benefitType": { "const": "free_night_award" } }, "required": ["benefitType"] },
          "then": { "required": ["freeNightAwardDetail"] }
        },
        {
          "if": { "properties": { "isOneTime": { "const": true } }, "required": ["isOneTime"] },
          "then": { "not": { "required": ["renewalPeriod"] } }
        }
      ]
    },

    "earningRate": {
      "type": "object",
      "description": "A permanent point/cashback multiplier for a spend category. No renewal period, no enrollment, no tracking — it's just the card's earning structure. Use this (not benefits[]/bonus_category) for base category bonuses like '3x on dining'.",
      "required": ["multiplier", "rewardUnit", "eligibleCategories"],
      "properties": {
        "multiplier": { "type": "number", "description": "e.g. 3 for 3x points or 3% cashback." },
        "rewardUnit": {
          "type": "string",
          "enum": ["points", "cashback_percent", "miles"]
        },
        "eligibleCategories": {
          "type": "array",
          "items": { "type": "string" },
          "description": "e.g. [\"dining\"], [\"chase_travel\"]. Use consistent category slugs across cards so the app can compare 'best card for category X' across issuers."
        },
        "spendCap": {
          "type": "object",
          "properties": {
            "amount": { "type": "number" },
            "period": { "$ref": "shared/period.schema.json" }
          },
          "additionalProperties": false,
          "description": "Only set if this rate has a spend cap before dropping to the base rate (uncommon for permanent rates, common for some cashback cards)."
        },
        "requiresActivation": {
          "type": "boolean",
          "description": "True for the rare permanent rate that still needs one-time enrollment (uncommon — most activation-gated multipliers belong in benefits[] as bonus_category instead, since 'requires activation' is usually a sign it's not truly a no-touch permanent rate)."
        },
        "terms": { "type": "string" },
        "sourceUrl": { "type": "string", "format": "uri" }
      },
      "additionalProperties": false
    },

    "statementCreditDetail": {
      "type": "object",
      "required": ["amount", "currency"],
      "properties": {
        "amount": { "type": "number" },
        "currency": { "const": "USD" },
        "eligibleMerchants": {
          "type": "array",
          "items": { "type": "string" },
          "description": "e.g. [\"Lululemon\"] for a merchant-locked credit. Omit or leave empty for a general-purpose credit (e.g. Amex Platinum's $200 travel credit, usable across many travel merchants)."
        },
        "splitEligible": {
          "type": "boolean",
          "description": "True when the annual amount is actually disbursed in smaller recurring chunks (e.g. Amex Uber Cash paid monthly) — pair with renewalPeriod set to the smaller cycle."
        }
      },
      "additionalProperties": false
    },
    "bonusCategoryDetail": {
      "type": "object",
      "required": ["multiplier", "rewardUnit"],
      "properties": {
        "multiplier": { "type": "number", "description": "e.g. 5 for 5x points or 5% cashback." },
        "rewardUnit": {
          "type": "string",
          "enum": ["points", "cashback_percent", "miles"]
        },
        "eligibleCategories": {
          "type": "array",
          "items": { "type": "string" },
          "description": "Categories that ALL earn the multiplier, e.g. [\"gas_stations\", \"grocery_stores\"]. For rotating categories, pair with renewalPeriod.anchor = fixed_dates. If the cardholder (or the issuer, per cycle) instead picks a subset from a menu, leave this out and use categorySelection — the two are mutually exclusive."
        },
        "categorySelection": {
          "type": "object",
          "required": ["mode", "options"],
          "properties": {
            "mode": {
              "type": "string",
              "enum": ["user_choice", "issuer_rotating", "automatic_top_category"],
              "description": "How the earning category gets picked each cycle. user_choice = cardholder actively selects (BoA Customized Cash, US Bank Cash+). issuer_rotating = issuer announces the category per cycle (Chase Freedom Flex, Discover it); pair with requiresActivation and renewalPeriod.anchor = fixed_dates. automatic_top_category = issuer applies it to the cardholder's highest-spend eligible category with no action needed (Citi Custom Cash)."
            },
            "options": {
              "type": "array",
              "items": { "type": "string" },
              "minItems": 1,
              "description": "The menu of category slugs that MAY be selected — not categories that all earn simultaneously. Use the same reusable slugs as eligibleCategories so cross-card comparison still works."
            },
            "selectCount": {
              "type": "integer",
              "minimum": 1,
              "default": 1,
              "description": "How many of `options` apply at once, e.g. 2 for US Bank Cash+ (two 5% categories per quarter)."
            },
            "changeableEachCycle": {
              "type": "boolean",
              "description": "True if the selection can be changed every renewalPeriod (BoA allows a monthly change). False/absent means the choice is fixed once made, or is out of the cardholder's hands entirely."
            }
          },
          "additionalProperties": false,
          "description": "Present when the multiplier applies to a SUBSET of categories chosen from a menu, rather than to every category listed. Records only the menu and how selection works — which option a given cardholder actually picked is per-user state and deliberately lives in the consuming app, not here (same boundary as benefit redemption state). Consumers that ignore this key should treat the benefit as unresolved rather than crediting every option at once."
        },
        "spendCap": {
          "type": "object",
          "properties": {
            "amount": { "type": "number" },
            "period": { "$ref": "shared/period.schema.json" }
          },
          "additionalProperties": false,
          "description": "e.g. $1,500 per quarter, after which the multiplier drops back to the base rate."
        },
        "requiresActivation": {
          "type": "boolean",
          "description": "True if the cardholder must manually opt in each cycle (common for rotating categories)."
        }
      },
      "additionalProperties": false,
      "not": { "required": ["eligibleCategories", "categorySelection"] }
    },
    "loungeAccessDetail": {
      "type": "object",
      "properties": {
        "networks": {
          "type": "array",
          "items": { "type": "string" },
          "description": "e.g. [\"Priority Pass\", \"Centurion Lounge\", \"Chase Sapphire Lounge\"]."
        },
        "guestPolicy": { "type": "string" }
      },
      "additionalProperties": false
    },
    "freeNightAwardDetail": {
      "type": "object",
      "properties": {
        "maxPointValue": { "type": "number" },
        "hotelProgram": { "type": "string", "description": "e.g. 'Marriott Bonvoy', 'World of Hyatt'." }
      },
      "additionalProperties": false
    },

    "sourceMeta": {
      "type": "object",
      "required": ["lastReviewedDate"],
      "properties": {
        "lastReviewedDate": { "type": "string", "format": "date" },
        "sourceUrls": {
          "type": "array",
          "items": { "type": "string", "format": "uri" }
        },
        "updatedBy": {
          "type": "string",
          "enum": ["agent", "human"],
          "description": "Tracks who last touched this record, for auditing agent update quality over time."
        }
      },
      "additionalProperties": false
    }
  }
}
