{
  "id": "chase-southwest-premier",
  "issuerId": "chase",
  "name": "Southwest Premier",
  "network": "Visa",
  "variant": "personal",
  "annualFee": {
    "amount": 149,
    "currency": "USD",
    "waivedFirstYear": false
  },
  "status": "active",
  "foreignTransactionFee": false,
  "benefits": [
    {
      "id": "sw-premier-free-checked-bag",
      "name": "First Checked Bag Free",
      "description": "First standard checked bag free for the primary cardmember and up to 8 passengers on the same reservation.",
      "benefitType": "other",
      "category": "airline",
      "isOneTime": true,
      "sourceUrl": "https://creditcards.chase.com/travel-credit-cards/southwest/premier",
      "lastVerified": "2026-09-14"
    },
    {
      "id": "sw-premier-anniversary-points",
      "name": "Anniversary Bonus Points",
      "description": "6,000 bonus Rapid Rewards points each account anniversary year.",
      "benefitType": "other",
      "category": "airline",
      "renewalPeriod": {
        "unit": "year",
        "count": 1,
        "anchor": "card_anniversary"
      },
      "sourceUrl": "https://creditcards.chase.com/travel-credit-cards/southwest/premier",
      "lastVerified": "2026-09-14"
    },
    {
      "id": "sw-premier-companion-pass-boost",
      "name": "Companion Pass Qualifying Points Boost",
      "description": "One boost of 10,000 Companion Pass qualifying points each calendar year.",
      "benefitType": "other",
      "category": "airline",
      "renewalPeriod": {
        "unit": "year",
        "count": 1,
        "anchor": "calendar"
      },
      "terms": "Applies toward Southwest Companion Pass qualification, not toward redeemable Rapid Rewards points balance.",
      "sourceUrl": "https://creditcards.chase.com/travel-credit-cards/southwest/premier",
      "lastVerified": "2026-09-14"
    },
    {
      "id": "sw-premier-flight-discount",
      "name": "Annual Flight Discount",
      "description": "One 15% flight discount promo code each account anniversary year.",
      "benefitType": "other",
      "category": "airline",
      "renewalPeriod": {
        "unit": "year",
        "count": 1,
        "anchor": "card_anniversary"
      },
      "terms": "Excludes Basic fares.",
      "sourceUrl": "https://creditcards.chase.com/travel-credit-cards/southwest/premier",
      "lastVerified": "2026-09-14"
    },
    {
      "id": "sw-premier-tier-qualifying-points",
      "name": "A-List Tier Qualifying Points",
      "description": "1,500 tier qualifying points (TQPs) toward Southwest A-List status for each $5,000 spent in purchases annually.",
      "benefitType": "other",
      "category": "airline",
      "renewalPeriod": {
        "unit": "year",
        "count": 1,
        "anchor": "calendar"
      },
      "sourceUrl": "https://creditcards.chase.com/travel-credit-cards/southwest/premier",
      "lastVerified": "2026-09-14"
    },
    {
      "id": "sw-premier-preferred-seat",
      "name": "Preferred Seat Selection",
      "description": "Complimentary Preferred seat selection when available, within 48 hours of departure, for the cardmember and up to 8 passengers on the same reservation.",
      "benefitType": "other",
      "category": "airline",
      "isOneTime": true,
      "sourceUrl": "https://creditcards.chase.com/travel-credit-cards/southwest/premier",
      "lastVerified": "2026-09-14"
    },
    {
      "id": "sw-premier-group-5-boarding",
      "name": "Group 5 Boarding",
      "description": "Group 5 boarding position for the cardmember and up to 8 passengers on the same reservation.",
      "benefitType": "other",
      "category": "airline",
      "isOneTime": true,
      "sourceUrl": "https://creditcards.chase.com/travel-credit-cards/southwest/premier",
      "lastVerified": "2026-09-14"
    }
  ],
  "earningRates": [
    {
      "multiplier": 3,
      "rewardUnit": "points",
      "eligibleCategories": [
        "southwest_airlines"
      ],
      "terms": "Southwest Airlines flights, inflight purchases, gift cards, and vacation packages booked directly.",
      "sourceUrl": "https://creditcards.chase.com/travel-credit-cards/southwest/premier"
    },
    {
      "multiplier": 2,
      "rewardUnit": "points",
      "eligibleCategories": [
        "grocery_stores",
        "dining"
      ],
      "spendCap": {
        "amount": 8000,
        "period": {
          "unit": "year",
          "count": 1,
          "anchor": "card_anniversary"
        }
      },
      "terms": "First $8,000 in combined grocery store and restaurant purchases per account anniversary year, then 1x.",
      "sourceUrl": "https://creditcards.chase.com/travel-credit-cards/southwest/premier"
    },
    {
      "multiplier": 25,
      "rewardUnit": "cashback_percent",
      "eligibleCategories": [
        "inflight_purchases"
      ],
      "terms": "25% back as a statement credit on Southwest inflight drink and WiFi purchases, applied automatically. No enrollment or cap.",
      "sourceUrl": "https://creditcards.chase.com/travel-credit-cards/southwest/premier"
    },
    {
      "multiplier": 1,
      "rewardUnit": "points",
      "eligibleCategories": [
        "everything_else"
      ],
      "sourceUrl": "https://creditcards.chase.com/travel-credit-cards/southwest/premier"
    }
  ],
  "sourceMeta": {
    "lastReviewedDate": "2026-09-14",
    "sourceUrls": [
      "https://creditcards.chase.com/travel-credit-cards/southwest/premier"
    ],
    "updatedBy": "agent"
  },
  "imageUrl": "data/assets/cards/chase-southwest-premier.png"
}
