{
  "id": "chase-southwest-plus",
  "issuerId": "chase",
  "name": "Southwest Plus",
  "network": "Visa",
  "variant": "personal",
  "annualFee": {
    "amount": 99,
    "currency": "USD",
    "waivedFirstYear": false
  },
  "status": "active",
  "foreignTransactionFee": false,
  "benefits": [
    {
      "id": "swpl-anniversary-points",
      "name": "Anniversary Bonus Points",
      "description": "3,000 bonus Rapid Rewards points awarded each account anniversary year.",
      "benefitType": "other",
      "category": "travel",
      "renewalPeriod": {
        "unit": "year",
        "count": 1,
        "anchor": "card_anniversary"
      },
      "terms": "Points post automatically each account anniversary year.",
      "sourceUrl": "https://creditcards.chase.com/travel-credit-cards/southwest/plus",
      "lastVerified": "2026-09-13"
    },
    {
      "id": "swpl-companion-pass-boost",
      "name": "Companion Pass Qualifying Points Boost",
      "description": "10,000 Companion Pass qualifying points credited each calendar year toward Southwest Companion Pass status.",
      "benefitType": "other",
      "category": "travel",
      "renewalPeriod": {
        "unit": "year",
        "count": 1,
        "anchor": "calendar"
      },
      "terms": "Boost is deposited each calendar year and counts toward the Companion Pass qualifying points threshold.",
      "sourceUrl": "https://creditcards.chase.com/travel-credit-cards/southwest/plus",
      "lastVerified": "2026-09-13"
    },
    {
      "id": "swpl-annual-flight-discount",
      "name": "10% Annual Flight Discount Code",
      "description": "One 10% discount promo code delivered each account anniversary year, valid on base fares.",
      "benefitType": "other",
      "category": "travel",
      "renewalPeriod": {
        "unit": "year",
        "count": 1,
        "anchor": "card_anniversary"
      },
      "terms": "Excludes Basic fares. Valid for one year from issuance.",
      "sourceUrl": "https://creditcards.chase.com/travel-credit-cards/southwest/plus",
      "lastVerified": "2026-09-13"
    },
    {
      "id": "swpl-free-checked-bag",
      "name": "First Checked Bag Free",
      "description": "First standard checked bag free for the primary cardmember and up to 8 passengers on the same reservation.",
      "benefitType": "other",
      "category": "airline",
      "isOneTime": true,
      "terms": "Applies to reservations that include the cardmember.",
      "sourceUrl": "https://creditcards.chase.com/travel-credit-cards/southwest/plus",
      "lastVerified": "2026-09-13"
    },
    {
      "id": "swpl-standard-seating",
      "name": "Standard Seat Selection",
      "description": "Complimentary Standard seat selection within 48 hours of departure, when available.",
      "benefitType": "other",
      "category": "airline",
      "isOneTime": true,
      "sourceUrl": "https://creditcards.chase.com/travel-credit-cards/southwest/plus",
      "lastVerified": "2026-09-13"
    },
    {
      "id": "swpl-group5-boarding",
      "name": "Group 5 Boarding",
      "description": "Group 5 boarding position for the cardmember and up to 8 additional passengers on the same reservation.",
      "benefitType": "other",
      "category": "airline",
      "isOneTime": true,
      "sourceUrl": "https://creditcards.chase.com/travel-credit-cards/southwest/plus",
      "lastVerified": "2026-09-13"
    },
    {
      "id": "swpl-inflight-rebate",
      "name": "Inflight Purchase Rebate",
      "description": "25% back as a statement credit on inflight Southwest Airlines purchases (drinks and WiFi).",
      "benefitType": "other",
      "category": "airline",
      "isOneTime": true,
      "terms": "25% rebate applied as a statement credit; no fixed annual cap disclosed.",
      "sourceUrl": "https://creditcards.chase.com/travel-credit-cards/southwest/plus",
      "lastVerified": "2026-09-13"
    },
    {
      "id": "swpl-dashpass",
      "name": "Complimentary DashPass Membership",
      "description": "12 months of complimentary DashPass membership, plus up to $10 off quarterly on eligible non-restaurant orders.",
      "benefitType": "membership",
      "category": "dining",
      "renewalPeriod": {
        "unit": "quarter",
        "count": 1,
        "anchor": "calendar"
      },
      "statementCreditDetail": {
        "amount": 10,
        "currency": "USD",
        "eligibleMerchants": [
          "DoorDash",
          "Caviar"
        ]
      },
      "terms": "Requires activation through Dec. 31, 2027 per current promotion; confirm this end date is still current before relying on it. Grants 12 months of DashPass plus quarterly $10 non-restaurant order credits.",
      "sourceUrl": "https://creditcards.chase.com/travel-credit-cards/southwest/plus",
      "lastVerified": "2026-09-13"
    },
    {
      "id": "swpl-instacart",
      "name": "Complimentary Instacart+ Membership",
      "description": "3 months of complimentary Instacart+ membership plus a $10 monthly Instacart credit.",
      "benefitType": "membership",
      "category": "shopping",
      "renewalPeriod": {
        "unit": "month",
        "count": 1,
        "anchor": "calendar"
      },
      "statementCreditDetail": {
        "amount": 10,
        "currency": "USD",
        "eligibleMerchants": [
          "Instacart"
        ]
      },
      "terms": "Promotional benefit through Dec. 31, 2027 per current terms; confirm this end date is still current before relying on it.",
      "sourceUrl": "https://creditcards.chase.com/travel-credit-cards/southwest/plus",
      "lastVerified": "2026-09-13"
    },
    {
      "id": "swpl-lyft-bonus-points",
      "name": "2x Points on Lyft",
      "description": "Earn 2x points on qualifying Lyft rides and services.",
      "benefitType": "bonus_category",
      "category": "transportation",
      "bonusCategoryDetail": {
        "multiplier": 2,
        "rewardUnit": "points",
        "eligibleCategories": [
          "lyft"
        ]
      },
      "terms": "Promotional rate through Dec. 31, 2027 per current terms; confirm this end date is still current before relying on it.",
      "sourceUrl": "https://creditcards.chase.com/travel-credit-cards/southwest/plus",
      "lastVerified": "2026-09-13"
    }
  ],
  "earningRates": [
    {
      "multiplier": 2,
      "rewardUnit": "points",
      "eligibleCategories": [
        "southwest_airlines"
      ],
      "terms": "Southwest Airlines purchases, including flights and inflight purchases.",
      "sourceUrl": "https://creditcards.chase.com/travel-credit-cards/southwest/plus"
    },
    {
      "multiplier": 2,
      "rewardUnit": "points",
      "eligibleCategories": [
        "gas_stations",
        "grocery_stores"
      ],
      "spendCap": {
        "amount": 5000,
        "period": {
          "unit": "year",
          "count": 1,
          "anchor": "calendar"
        }
      },
      "terms": "First $5,000 in combined gas station and grocery store spend per calendar year, then 1x.",
      "sourceUrl": "https://creditcards.chase.com/travel-credit-cards/southwest/plus"
    },
    {
      "multiplier": 1,
      "rewardUnit": "points",
      "eligibleCategories": [
        "everything_else"
      ],
      "sourceUrl": "https://creditcards.chase.com/travel-credit-cards/southwest/plus"
    }
  ],
  "sourceMeta": {
    "lastReviewedDate": "2026-09-14",
    "sourceUrls": [
      "https://creditcards.chase.com/travel-credit-cards/southwest/plus"
    ],
    "updatedBy": "agent"
  },
  "imageUrl": "data/assets/cards/chase-southwest-plus.png"
}
