{
  "id": "penfed-credit-union-pathfinder",
  "issuerId": "penfed-credit-union",
  "name": "Pathfinder",
  "network": "Visa",
  "variant": "personal",
  "annualFee": {
    "amount": 95,
    "currency": "USD",
    "waivedFirstYear": false
  },
  "status": "active",
  "foreignTransactionFee": false,
  "benefits": [
    {
      "id": "pf-annual-travel-credit",
      "name": "Annual Travel Credit",
      "description": "Statement credit toward incidental air travel fees such as baggage fees, flight-change fees, in-flight food and beverage purchases, and airport lounge day passes.",
      "benefitType": "statement_credit",
      "category": "airline",
      "renewalPeriod": {
        "unit": "year",
        "count": 1,
        "anchor": "calendar"
      },
      "statementCreditDetail": {
        "amount": 100,
        "currency": "USD",
        "eligibleMerchants": [
          "airlines (incidental fees)"
        ]
      },
      "terms": "Up to $100 per calendar year toward incidental air travel fees, not the cost of the ticket itself.",
      "sourceUrl": "https://www.penfed.org/content/dam/penfed/general/pdf/creditcardpdfs/Visa/penfed-pathfinder-travel-credits.pdf",
      "lastVerified": "2026-09-20"
    },
    {
      "id": "pf-trusted-traveler-credit",
      "name": "TSA PreCheck / Global Entry Credit",
      "description": "Statement credit for a TSA PreCheck or Global Entry application fee.",
      "benefitType": "trusted_traveler_credit",
      "category": "travel",
      "renewalPeriod": {
        "unit": "year",
        "count": 4,
        "anchor": "card_anniversary"
      },
      "statementCreditDetail": {
        "amount": 100,
        "currency": "USD",
        "eligibleMerchants": [
          "TSA PreCheck",
          "Global Entry"
        ]
      },
      "terms": "Up to $100 for Global Entry or $85 for TSA PreCheck. Reported renewal cadence varies by source (roughly every 4-5 years, matching the underlying program's own renewal cycle); confirm current cadence before relying on it.",
      "sourceUrl": "https://www.penfed.org/credit-cards/pathfinder-rewards-visa",
      "lastVerified": "2026-09-20"
    },
    {
      "id": "pf-priority-pass",
      "name": "Priority Pass Select Membership",
      "description": "Complimentary annual Priority Pass Select membership providing access to 1,200+ airport lounges worldwide, with an accompanying guest.",
      "benefitType": "lounge_access",
      "category": "travel",
      "isOneTime": true,
      "loungeAccessDetail": {
        "networks": [
          "Priority Pass"
        ],
        "guestPolicy": "One accompanying guest included."
      },
      "terms": "Enrollment required through PenFed to activate the Priority Pass Select membership.",
      "sourceUrl": "https://www.penfed.org/credit-cards/pathfinder-rewards-visa",
      "lastVerified": "2026-09-20"
    },
    {
      "id": "pf-rental-car-insurance",
      "name": "Auto Rental Collision/Loss Damage Insurance",
      "description": "Coverage for physical damage, theft, reasonable and customary towing, and loss-of-use charges on most rental vehicles.",
      "benefitType": "insurance",
      "category": "travel",
      "isOneTime": true,
      "sourceUrl": "https://www.penfed.org/credit-cards/pathfinder-rewards-visa",
      "lastVerified": "2026-09-20"
    },
    {
      "id": "pf-trip-delay-insurance",
      "name": "Trip Delay Reimbursement",
      "description": "Reimbursement up to $300 per purchased ticket for reasonable expenses when a trip is delayed more than 12 hours.",
      "benefitType": "insurance",
      "category": "travel",
      "isOneTime": true,
      "sourceUrl": "https://www.penfed.org/credit-cards/pathfinder-rewards-visa",
      "lastVerified": "2026-09-20"
    },
    {
      "id": "pf-cell-phone-protection",
      "name": "Cell Phone Protection",
      "description": "Coverage for cell phone damage or theft when the monthly bill is paid with the card.",
      "benefitType": "insurance",
      "category": "wireless",
      "renewalPeriod": {
        "unit": "year",
        "count": 1,
        "anchor": "calendar"
      },
      "terms": "Requires paying the monthly cell phone bill with the card.",
      "sourceUrl": "https://www.penfed.org/credit-cards/pathfinder-rewards-visa",
      "lastVerified": "2026-09-20"
    }
  ],
  "earningRates": [
    {
      "multiplier": 3,
      "rewardUnit": "points",
      "eligibleCategories": [
        "travel"
      ],
      "terms": "Standard rate is 3x points on travel purchases. Honors Advantage members (PenFed checking account holders or eligible military-affiliated members) earn 4x on travel instead; that tier isn't separately modeled here.",
      "sourceUrl": "https://money.usnews.com/credit-cards/penfed/penfed-pathfinder-rewards-visa-signature-card"
    },
    {
      "multiplier": 1.5,
      "rewardUnit": "points",
      "eligibleCategories": [
        "everything_else"
      ],
      "sourceUrl": "https://money.usnews.com/credit-cards/penfed/penfed-pathfinder-rewards-visa-signature-card"
    }
  ],
  "sourceMeta": {
    "lastReviewedDate": "2026-09-20",
    "sourceUrls": [
      "https://www.penfed.org/credit-cards/pathfinder-rewards",
      "https://www.penfed.org/credit-cards/pathfinder-rewards-visa",
      "https://www.penfed.org/content/dam/penfed/general/pdf/creditcardpdfs/Visa/penfed-pathfinder-travel-credits.pdf",
      "https://money.usnews.com/credit-cards/penfed/penfed-pathfinder-rewards-visa-signature-card"
    ],
    "updatedBy": "agent"
  },
  "imageUrl": "data/assets/cards/penfed-credit-union-pathfinder.png"
}
